<?xml version="1.0" encoding="utf-8" ?>
<Artifact xmlns:xsi="http://www.w3.org/2001/XMLSchema-instance" xsi:noNamespaceSchemaLocation="../../Data/Artifact.xsd">
	<Name>Apple</Name>
	<Rarity>Common</Rarity>
	<Description>A shiny red apple that restores a small amount of health.</Description>
	<IconResourcePath>Icons/Apple</IconResourcePath>
	<Level Tier="1">
		<StatModifiers>
			<HealthModifier AdditionalHealth="5"/>
		</StatModifiers>
	</Level>
	<Level Tier="2">
		<StatModifiers>
			<HealthModifier AdditionalHealth="10"/>
		</StatModifiers>
	</Level>
	<Level Tier="3">
		<StatModifiers>
			<HealthModifier AdditionalHealth="15"/>
		</StatModifiers>
	</Level>
	<Level Tier="4">
		<StatModifiers>
			<HealthModifier AdditionalHealth="20"/>
		</StatModifiers>
	</Level>
	<Level Tier="5">
		<StatModifiers>
			<HealthModifier AdditionalHealth="25"/>
		</StatModifiers>
	</Level>
</Artifact>